<?xml version="1.0" encoding="UTF-8" ?>

<tariffs xmlns="http://www.example.com/tariffs"
         xmlns:xsi="http://www.w3.org/2001/XMLSchema-instance"
         xsi:schemaLocation="http://www.example.com/tariffs tariffs111.xsd">
    <tariff name="Comfort S" id="tariff1">
        <creationTariffDay>2019-08-19</creationTariffDay>
        <operator>A1</operator>
        <payroll>12.99</payroll>
        <smsPrices>0.25</smsPrices>
        <prices>
            <callPrices>
                <inner>0</inner>
                <outer>0.75</outer>
                <linear>0.75</linear>
            </callPrices>
        </prices>
        <parameters>
            <voiceParameters>
                <favoriteNumberCount>0</favoriteNumberCount>
                <billingInSec>60</billingInSec>
                <prepayment>5</prepayment>
            </voiceParameters>
        </parameters>
    </tariff>

    <tariff name="Comfort M" id="tariff2">
        <creationTariffDay>2019-08-19</creationTariffDay>
        <operator>A1</operator>
        <payroll>17.99</payroll>
        <smsPrices>0.25</smsPrices>
        <prices>
            <callPrices>
                <inner>0</inner>
                <outer>0.035</outer>
                <linear>0.035</linear>
            </callPrices>
        </prices>
        <parameters>
            <voiceParameters>
                <favoriteNumberCount>0</favoriteNumberCount>
                <billingInSec>60</billingInSec>
                <prepayment>5</prepayment>
            </voiceParameters>
        </parameters>
    </tariff>

    <tariff name="Comfort L" id="tariff3">
        <creationTariffDay>2019-08-19</creationTariffDay>
        <operator>A1</operator>
        <payroll>25.99</payroll>
        <prices>
            <callPrices>
                <inner>0</inner>
                <outer>0.075</outer>
                <linear>0.075</linear>
            </callPrices>
        </prices>
        <parameters>
            <voiceParameters>
                <favoriteNumberCount>0</favoriteNumberCount>
                <billingInSec>60</billingInSec>
                <prepayment>5</prepayment>
            </voiceParameters>
        </parameters>
        <smsPrices>0.025</smsPrices>
    </tariff>

    <tariff name="Lemon" id="tariff4">
        <creationTariffDay>2018-07-05</creationTariffDay>
        <operator>A1</operator>
        <payroll>29.99</payroll>
        <prices>
            <callPrices>
                <inner>0</inner>
                <outer>0.075</outer>
                <linear>0.075</linear>
            </callPrices>
        </prices>
        <parameters>
            <voiceParameters>
                <favoriteNumberCount>0</favoriteNumberCount>
                <billingInSec>60</billingInSec>
                <prepayment>5</prepayment>
            </voiceParameters>
        </parameters>
        <smsPrices>0.025</smsPrices>
    </tariff>


    <tariff name="Lemon s" id="tariff5">
        <creationTariffDay>2018-07-05</creationTariffDay>
        <operator>A1</operator>
        <payroll>29.99</payroll>
        <prices>
            <callPrices>
                <inner>0</inner>
                <outer>0.075</outer>
                <linear>0.075</linear>
            </callPrices>
            <internetPrices>
                <overspendingFeeValueForMb>0.03</overspendingFeeValueForMb>
            </internetPrices>
        </prices>
        <parameters>
            <internetParameters>
                <includedTraffic>1024</includedTraffic>
                <billingInMB>0.01</billingInMB>
                <prepayment>5</prepayment>
            </internetParameters>
        </parameters>
        <smsPrices>0.025</smsPrices>
    </tariff>


</tariffs>